{
  "blockers": [
    {
      "id": "blocker.packet",
      "reason": "Source packet reports a blocker.",
      "source": "source-tool"
    }
  ],
  "counts": {
    "blockers": 1,
    "findings_by_severity": {
      "critical": 0,
      "high": 0,
      "info": 0,
      "low": 0,
      "medium": 0
    },
    "preserved_stricter_local_rules": 0,
    "rejected_assumptions": 0,
    "required_decisions": 1,
    "total_findings": 0
  },
  "evidence_file": "EVIDENCE.json",
  "findings": [],
  "generated_artifacts": [
    "REVIEW-SUMMARY.json",
    "EVIDENCE.json",
    "FINDINGS.md",
    "RECOMMENDED-ACTIONS.md"
  ],
  "preserved_stricter_local_rules": [],
  "recommended_actions": [],
  "recommended_actions_file": "RECOMMENDED-ACTIONS.md",
  "rejected_assumptions": [],
  "required_decisions": [
    {
      "id": "decision.packet",
      "reason": "Source packet requires a human decision.",
      "source": "source-tool"
    }
  ],
  "schema_version": "review-packet/v1",
  "status": "blocked",
  "target_project": {
    "path": "fixtures/blockers"
  },
  "tool": {
    "generated_files": [
      {
        "path": "REVIEW-SUMMARY.json"
      },
      {
        "path": "EVIDENCE.json"
      },
      {
        "path": "FINDINGS.md"
      },
      {
        "path": "RECOMMENDED-ACTIONS.md"
      }
    ],
    "input": {
      "target_path": "fixtures/blockers"
    },
    "policy_hashes": {
      "fixture": "ffffffffffffffffffffffffffffffffffffffffffffffffffffffffffffffff"
    },
    "read_write_behavior": "review_output_only",
    "requested_outputs": [
      "REVIEW-SUMMARY.json",
      "EVIDENCE.json",
      "FINDINGS.md",
      "RECOMMENDED-ACTIONS.md"
    ],
    "run_timestamp": "2026-05-08T00:00:00Z",
    "safety_profile": {
      "review_only": true,
      "secret_policy": "path-only-secret-evidence",
      "target_mutation": "none"
    },
    "schema_versions": {
      "review_packet": "review-packet/v1"
    },
    "source_commit": null,
    "target_project": {
      "path": "fixtures/blockers"
    },
    "tool_name": "blocker-reviewer",
    "tool_version": "0.1.0"
  }
}
